{
  "schemaVersion": "harvest-seed-packet-v1@1.0.0",
  "seedId": "IH-HOT-CACHE-SECOND-HOST-SSH-001",
  "kind": "command",
  "title": "Second-host hot-cache gate via SSH to WESLEYDESK",
  "summary": "When WESLEY_WORK lacks S: cache mount, run refresh-all and scout on WESLEYDESK via cgremoteadmin@wesleydesk SSH.",
  "retrievalQuestions": [
    "How to prove hot-cache consumption on WESLEYDESK from WESLEY_WORK?",
    "Which SSH user works for wesleydesk second-host gates?"
  ],
  "evidenceRefs": [
    "EVT-410",
    "cgremoteadmin@wesleydesk",
    "/mnt/s/AI Cursur Cache"
  ],
  "executionDeltaRefs": ["ED-403"],
  "wasteIds": ["TW-403"],
  "roiRank": 3,
  "futureAgentInstructions": {
    "whenThisAppears": "Estate ship requires second-host proof but primary WSL has HOT_CACHE_ROOT_MISSING",
    "startAt": [
      "work-progress/command-index.json",
      "~/.ssh/wesleydesk_cgremoteadmin"
    ],
    "runPreflight": [
      "test -d /mnt/s/AI Cursur Cache || ssh -i ~/.ssh/wesleydesk_cgremoteadmin cgremoteadmin@wesleydesk hostname"
    ],
    "doNot": [
      "Fake second-host proof by setting CG_WSL_MACHINE_ROLE without correct cache root",
      "Claim WAVE_A_ESTATE_SHIPPED from WESLEY_WORK alone"
    ],
    "proveBeforeClaiming": [
      "ssh gate: export CG_WSL_MACHINE_ROLE=wesleydesk; npm run hot-cache:refresh-all:json",
      "npm run agent:index:scout -- --json with INDEX_HIT_AI_CACHE"
    ]
  },
  "ownerRepo": "CapitalGlass-Office-Admin",
  "targetSlice": "BY-KIND/thread-autopsy-index.json",
  "promotionClass": "AUTOMATIC",
  "status": "CANDIDATE"
}
