{
  "schemaVersion": "harvest-seed-packet-v1@1.0.0",
  "seedId": "IH-ASG-PHASE-STATE-SEMANTICS-008",
  "kind": "runbook",
  "title": "ASG phase state semantics — Phase B vs Phase C pointer gates",
  "summary": "Phase C Git pointer materialization requires phase-b-v2 completion and explicit PHASE_C_POINTER_APPROVED=1; Phase B publishes L/Supabase pointers only.",
  "retrievalQuestions": [
    "When can ASG Phase C Git pointer be materialized?",
    "What is the difference between Phase B and Phase C publication?"
  ],
  "evidenceRefs": [
    "06111bc4 formal GO receipt",
    "phase-state-semantics.mjs"
  ],
  "futureAgentInstructions": {
    "whenThisAppears": "Operator asks to publish Phase C or Git pointer harvest seeds",
    "startAt": [
      "CG-AppBuilder-MCP/scripts/ultimate-sdlc-runner/lib/phase-state-semantics.mjs",
      "CapitalGlass-Cross-Agent/scripts/harvest/materialize-publication-pointer.mjs",
      "Z:/Capital-Glass-Intelligence-Hub/AI-Cache-Authority/operational-control/all-systems-go/asg-operational-authority-v1"
    ],
    "runPreflight": [
      "npm run harvest:check-operational-verdict -- --harvest-id=<id>"
    ],
    "doNot": [
      "Run Phase C without PHASE_C_POINTER_APPROVED=1",
      "Use Phase C to mask missing L mirror or Supabase metadata projection"
    ],
    "proveBeforeClaiming": [
      "L mirror CURRENT for asg-operational-authority-v1",
      "Supabase slice asg-operational-authority-v1 IN_SYNC",
      "phase-b-v2 receipt PASS before Phase C"
    ]
  },
  "ownerRepo": "CG-AppBuilder-MCP",
  "targetSlice": "BY-KIND/thread-autopsy-index.json",
  "promotionClass": "AUTOMATIC",
  "status": "CANDIDATE",
  "roiRank": 4,
  "sourcePacketIds": ["asg-hardening-authority-v1"]
}
