{
  "schemaVersion": "harvest-seed-packet-v1@1.0.0",
  "seedId": "IH-ASG-FORMAL-GO-EVIDENCE-009",
  "kind": "command",
  "title": "ASG formal GO evidence — formalGoEligible, zeroWritesProven, six lanes",
  "summary": "Formal GO requires systemsGoVerdict GO, formalGoEligible true, zeroWritesProven true, all six lanes PASS, live target proof, and receipt schema v1.4.0 authority enrichment.",
  "retrievalQuestions": [
    "What fields prove formal All Systems Go GO?",
    "How to validate a hardened ASG receipt with require-formal-go?"
  ],
  "evidenceRefs": [
    "06111bc4 dark-runner-receipt.json",
    "receipt-authority.mjs",
    "validate-receipt-authority.mjs",
    "git e848c1fe"
  ],
  "futureAgentInstructions": {
    "whenThisAppears": "Material suite work or GO claim after hardening milestone",
    "startAt": [
      "Z:/Capital-Glass-Intelligence-Hub/AI-Cache-Authority/operational-control/all-systems-go/asg-operational-authority-v1/04-receipt-examples/final-go-receipt.pointer.json",
      "CG-AppBuilder-MCP/scripts/ultimate-sdlc-runner/validate-receipt-authority.mjs",
      "CG-AppBuilder-MCP/artifacts/agent-runs/ultimate-sdlc-runner-hardening-and-ai-cache-v1/06111bc4-fb53-4e50-98a9-b02659c770c5/dark-runner-receipt.json"
    ],
    "runPreflight": [
      "npm run all-systems-go:validate-receipt -- --receipt=<formal-receipt> --require-formal-go",
      "npm run agent:index:scout -- --json"
    ],
    "doNot": [
      "Use ultimate-sdlc-runner-dark-package-v1 receipt as governing authority",
      "Claim GO without liveTargetProven when WSL Supabase CLI works",
      "Republish Z package without source hash drift"
    ],
    "proveBeforeClaiming": [
      "systemsGoVerdict GO",
      "formalGoEligible true",
      "zeroWritesProven true",
      "six lanes PASS",
      "validate-receipt PASS with --require-formal-go"
    ]
  },
  "ownerRepo": "CG-AppBuilder-MCP",
  "targetSlice": "BY-KIND/thread-autopsy-index.json",
  "promotionClass": "AUTOMATIC",
  "status": "CANDIDATE",
  "roiRank": 5,
  "sourcePacketIds": ["asg-hardening-authority-v1"]
}
