{
  "schemaVersion": "harvest-seed-packet-v1@1.0.0",
  "seedId": "IH-WESLEYWORK-WSCRIPT-LAUNCHER-PATTERN-001",
  "kind": "failure-pattern",
  "title": "CapitalGlass scheduled tasks — wscript //B //Nologo -> VBS window style 0 -> hidden runtime",
  "summary": "Approved no-flash launcher chain for unattended WESLEY_WORK tasks; direct powershell.exe/cmd.exe/node.exe task actions are noncompliant.",
  "retrievalQuestions": [
    "What is the approved Capital Glass scheduled task launcher on Windows?",
    "Why does Hidden=True alone not prove no terminal flash?",
    "How were Bible and AI-cache reconcile tasks hardened?"
  ],
  "evidenceRefs": [
    "harvest-2026-08-06-wesleywork-terminal-flash-closeout-v1",
    "Register-OfficeHiddenScheduledTask.ps1",
    "TE-004",
    "TE-005"
  ],
  "futureAgentInstructions": {
    "whenThisAppears": "Converting or auditing CapitalGlass-* scheduled tasks on WESLEY_WORK",
    "startAt": [
      "scripts/devices/common/Register-OfficeHiddenScheduledTask.ps1",
      "Test-CgWesleyWorkTerminalFlashScheduledTaskAudit.ps1"
    ],
    "runPreflight": [
      "Test-CgWesleyWorkTerminalFlashScheduledTaskAudit.ps1 -Phase full"
    ],
    "doNot": [
      "Use schtasks /Create without hidden wscript configuration",
      "Use shell:true spawn for unattended Node descendants",
      "Treat Hidden=True or -WindowStyle Hidden as sufficient proof"
    ],
    "proveBeforeClaiming": [
      "Task action Execute is wscript.exe with //B //Nologo",
      "Poll shows zero WindowsTerminal.exe -Embedding at real cadence boundary"
    ]
  },
  "ownerRepo": "CapitalGlass-Office-Admin",
  "targetSlice": "BY-KIND/thread-autopsy-index.json",
  "promotionClass": "POLICY_GATED",
  "status": "CANDIDATE"
}
